{
    "schema_version":  "2.0-minor-swords",
    "deck_id":  "rider-waite-smith",
    "coverage":  {
                     "card_count":  14,
                     "notes_vi":  "V2 cho 14 lá suit Kiếm, sinh từ rank framework + suit framework đã lưu trong rule data."
                 },
    "cards":  [
                  {
                      "id":  "swords-01-ace",
                      "source_basis":  [
                                           "waite",
                                           "golden_dawn_book_t",
                                           "joan_bunning_learning_tarot",
                                           "benebell_holistic_tarot",
                                           "product_editorial"
                                       ],
                      "core":  {
                                   "essence_vi":  "Át Kiếm kết hợp năng lượng hạt giống mới với lĩnh vực suy nghĩ, sự thật, giao tiếp và xung đột tinh thần. Cốt lõi là một cơ hội nguyên sơ vừa mở ra.",
                                   "keywords_vi":  [
                                                       "hạt giống mới",
                                                       "suy nghĩ, sự thật, giao tiếp và xung đột tinh thần",
                                                       "một cơ hội nguyên sơ vừa mở ra"
                                                   ],
                                   "shadow_keywords_vi":  [
                                                              "lo âu, lạnh cảm xúc, phán xét, phòng thủ hoặc nói sắc quá",
                                                              "khó phân biệt tiềm năng thật với cảm hứng thoáng qua"
                                                          ]
                               },
                      "orientation":  {
                                          "upright":  {
                                                          "general_vi":  "có tín hiệu mới đáng chú ý, nhưng nó mới là hạt giống và cần được nuôi đúng cách. Với suit Kiếm, trọng tâm rơi vào suy nghĩ, sự thật, giao tiếp và xung đột tinh thần.",
                                                          "love_vi":  "Trong tình yêu, Át Kiếm nói về lời nói, hiểu lầm, ranh giới tinh thần và sự thật cần được nói ra. có tín hiệu mới đáng chú ý, nhưng nó mới là hạt giống và cần được nuôi đúng cách.",
                                                          "career_vi":  "Về công việc, lá này đặt hạt giống mới vào quyết định, chiến lược, tranh luận, dữ kiện và áp lực trí óc. có tín hiệu mới đáng chú ý, nhưng nó mới là hạt giống và cần được nuôi đúng cách.",
                                                          "money_vi":  "Về tiền bạc, lá này liên quan phân tích rủi ro, hợp đồng, quyết định dựa trên dữ kiện và tránh suy nghĩ cực đoan. có tín hiệu mới đáng chú ý, nhưng nó mới là hạt giống và cần được nuôi đúng cách.",
                                                          "inner_work_vi":  "Ở tầng nội tâm, lá này chạm tới tiếng nói trong đầu, nỗi sợ, niềm tin và cách bạn diễn giải sự việc. có tín hiệu mới đáng chú ý, nhưng nó mới là hạt giống và cần được nuôi đúng cách.",
                                                          "advice_vi":  "đón cơ hội bằng một bước nhỏ, không vội biến nó thành cam kết lớn. nói rõ, kiểm chứng dữ kiện và cắt bớt suy diễn.",
                                                          "warning_vi":  "sự thật không nên được dùng như vũ khí. Điểm cần tránh là khó phân biệt tiềm năng thật với cảm hứng thoáng qua."
                                                      },
                                          "reversed":  {
                                                           "general_vi":  "cơ hội có đó nhưng bị chậm, bị bỏ lỡ hoặc chưa đủ nền để nảy mầm. Mặt lệch của suit Kiếm là lo âu, lạnh cảm xúc, phán xét, phòng thủ hoặc nói sắc quá.",
                                                           "love_vi":  "Trong tình yêu, lá ngược cho thấy lời nói, hiểu lầm, ranh giới tinh thần và sự thật cần được nói ra đang bị chặn hoặc lệch. cơ hội có đó nhưng bị chậm, bị bỏ lỡ hoặc chưa đủ nền để nảy mầm.",
                                                           "career_vi":  "Về công việc, lá ngược cảnh báo quyết định, chiến lược, tranh luận, dữ kiện và áp lực trí óc đang thiếu nhịp, thiếu hướng hoặc thiếu sự trưởng thành phù hợp. cơ hội có đó nhưng bị chậm, bị bỏ lỡ hoặc chưa đủ nền để nảy mầm.",
                                                           "money_vi":  "Về tiền bạc, cần cẩn trọng vì phân tích rủi ro, hợp đồng, quyết định dựa trên dữ kiện và tránh suy nghĩ cực đoan có thể bị chi phối bởi mặt lệch: lo âu, lạnh cảm xúc, phán xét, phòng thủ hoặc nói sắc quá.",
                                                           "inner_work_vi":  "Ở tầng nội tâm, lá ngược cho thấy bạn cần nhìn lại tiếng nói trong đầu, nỗi sợ, niềm tin và cách bạn diễn giải sự việc khi nó bị kéo bởi lo âu, lạnh cảm xúc, phán xét, phòng thủ hoặc nói sắc quá.",
                                                           "advice_vi":  "đón cơ hội bằng một bước nhỏ, không vội biến nó thành cam kết lớn, nhưng trước hết hãy xử lý phần bị chặn: khó phân biệt tiềm năng thật với cảm hứng thoáng qua.",
                                                           "warning_vi":  "Nếu không điều chỉnh, lo âu, lạnh cảm xúc, phán xét, phòng thủ hoặc nói sắc quá sẽ làm hạt giống mới biến thành điểm nghẽn."
                                                       }
                                      },
                      "position_overrides":  {
                                                 "situation":  "Tình huống đang biểu hiện hạt giống mới trong vùng suy nghĩ, sự thật, giao tiếp và xung đột tinh thần.",
                                                 "action":  "đón cơ hội bằng một bước nhỏ, không vội biến nó thành cam kết lớn",
                                                 "outcome":  "một cửa mới mở ra, kết quả phụ thuộc vào cách bạn chăm nó",
                                                 "challenge":  "khó phân biệt tiềm năng thật với cảm hứng thoáng qua",
                                                 "future":  "một cửa mới mở ra, kết quả phụ thuộc vào cách bạn chăm nó"
                                             },
                      "relationship_signals":  {
                                                   "default":  "có tín hiệu mới hoặc mong muốn làm mới, nhưng cần xem nó có được nuôi bằng hành động không. Với Kiếm, hãy quan sát lời nói, hiểu lầm, ranh giới tinh thần và sự thật cần được nói ra.",
                                                   "existing_relationship":  "Nếu hỏi có nên tiếp tục, Át Kiếm yêu cầu xem lời nói, hiểu lầm, ranh giới tinh thần và sự thật cần được nói ra đang giúp hai bên tiến gần hơn hay chỉ lặp lại cùng mô thức. Trục chính là hạt giống mới.",
                                                   "situationship":  "Trong mập mờ, lá này nhấn vào một cơ hội nguyên sơ vừa mở ra trong vùng suy nghĩ, sự thật, giao tiếp và xung đột tinh thần. Dấu hiệu cần xem là có chuyển thành hành động rõ hay chỉ dừng ở cảm giác.",
                                                   "ex":  "Với người cũ, Át Kiếm hỏi liệu bài học hạt giống mới đã được hiểu chưa, hay hai bên chỉ đang chạm lại vì thói quen cũ.",
                                                   "no_contact":  "Nếu đang im lặng, lá này cho thấy năng lượng Kiếm đang bị giữ lại. Hãy xem dấu hiệu liên hệ nếu có mang tính trưởng thành hay chỉ là xung lực."
                                               },
                      "symbols":  [
                                      {
                                          "symbol":  "suit Kiếm",
                                          "meaning_vi":  "Đưa trọng tâm về suy nghĩ, sự thật, giao tiếp và xung đột tinh thần, thuộc nguyên tố Khí."
                                      },
                                      {
                                          "symbol":  "rank Át",
                                          "meaning_vi":  "Đưa câu chuyện vào giai đoạn hạt giống mới."
                                      }
                                  ],
                      "reader_notes_vi":  [
                                              "Đọc lá này bằng cách kết hợp rank trước, suit sau: hạt giống mới + suy nghĩ, sự thật, giao tiếp và xung đột tinh thần.",
                                              "Không đổi nghĩa gốc của lá; V2 chỉ giúp diễn giải theo ngữ cảnh câu hỏi và position."
                                          ]
                  },
                  {
                      "id":  "swords-02-two",
                      "source_basis":  [
                                           "waite",
                                           "golden_dawn_book_t",
                                           "joan_bunning_learning_tarot",
                                           "benebell_holistic_tarot",
                                           "product_editorial"
                                       ],
                      "core":  {
                                   "essence_vi":  "Hai Kiếm kết hợp năng lượng lựa chọn và cân bằng với lĩnh vực suy nghĩ, sự thật, giao tiếp và xung đột tinh thần. Cốt lõi là hai lực, hai hướng hoặc hai người đang cần tìm điểm cân bằng.",
                                   "keywords_vi":  [
                                                       "lựa chọn và cân bằng",
                                                       "suy nghĩ, sự thật, giao tiếp và xung đột tinh thần",
                                                       "hai lực, hai hướng hoặc hai người đang cần tìm điểm cân bằng"
                                                   ],
                                   "shadow_keywords_vi":  [
                                                              "lo âu, lạnh cảm xúc, phán xét, phòng thủ hoặc nói sắc quá",